<?xml version="1.0" encoding="UTF-8"?>
<rapport 
    xmlns="super-ag.com/rapporte"
    xmlns:gugus="https:/ /www.w3.org/2001/XMLSchema-instance" 
    gugus:schemaLocation="super-ag.com/rapporte zeiterfassung.xsd"
    xmlns:fin="super-ag.com/finance">
    <arbeitszeiten>
        <eintrag ort="">
            <datum-von>2023-09-05T13:45:00</datum-von>
            <datum-bis>2023-09-05T14:45:00</datum-bis>
            <taetigkeit>XSD Einf√ºhrung</taetigkeit>
            <verrechenbar>halb</verrechenbar>
            <fin:projektnummer>A123</fin:projektnummer>
        </eintrag>
    </arbeitszeiten>
</rapport>